{
  "schema_version": "highambench-faithfulness-0.1",
  "role": "adjudicator",
  "task_id": "P01-T1",
  "trigger": [
    "judge classifications differ",
    "source contract contains ambiguity"
  ],
  "resolved_items": [
    {
      "item": "judge classifications differ",
      "resolution": "The correct classification is faithful-equivalent. The selected source packet combines equation (3.6) with the explicitly cited nonnegative-input simplification. The resulting selected proposition is the nonnegative specialization, not unrestricted equation (3.6). The round-trip judgment compared the translation against the unrestricted signed-input theorem and therefore used the wrong comparison scope.",
      "primary_evidence": "PDF page 6, printed page 788, states |E_n| <= gamma_(log2 n) sum_i |x_i| for n=2^r. PDF page 3, printed page 785, states that for nonnegative inputs the sum of input magnitudes equals the exact sum. The Lean declaration assumes forall i, 0 <= v i and concludes |pairwiseSum-exactSum| <= gamma_r*exactSum."
    },
    {
      "item": "source contract contains ambiguity",
      "resolution": "Every listed ambiguity is either resolved by the mathematical requirements of the displayed formulas or is outside the selected absolute-error proposition. The gamma condition is implicit but necessary; the target exactly uses the power-of-two case; the all-zero issue affects only relative division; and representability or exceptional-value questions delimit the standard-model abstraction without changing the selected inequality.",
      "primary_evidence": "The relevant primary passages are the finite-product display on PDF page 2, the absolute and relative bounds on PDF page 3, and the pairwise definition and equation (3.6) on PDF page 6. The exact declaration and D001-D007 expose the corresponding formal conditions and model."
    },
    {
      "item": "S04 and S15: nonnegative specialization",
      "resolution": "Nonnegativity is not an unintended restriction relative to the selected P01-T1 result. It is the explicitly selected specialization used to replace sum_i |x_i| by sum_i x_i. The declaration must not, however, be presented as the unrestricted signed-input form of equation (3.6).",
      "primary_evidence": "Equation (3.6) on printed page 788 has sum_i |x_i|. The paragraph on printed page 785 identifies the simplification for x_i >= 0. The target has hv : forall i, 0 <= v i and uses the exact sum without absolute values on individual inputs."
    },
    {
      "item": "S05: conclusion completeness",
      "resolution": "The target contains the complete selected error-bound conclusion. The pathwise product relation preceding equation (3.6) is a derivation used to prove the bound, not an additional conjunct of equation (3.6). The relative-error formula on printed page 785 is a separate quotient statement and is not part of this selected absolute-error target.",
      "primary_evidence": "On printed page 788 the pathwise relation is followed by the words 'which leads to the bound' and then the separately numbered equation (3.6). The Lean conclusion is exactly the corresponding absolute scalar inequality and contains no relative-error quotient."
    },
    {
      "item": "D001 and D005: gamma-domain ambiguity",
      "resolution": "The paper omits m*u<1 beside the finite-product display, but the condition is mathematically implicit: without a positive denominator, gamma_m cannot be the displayed finite nonnegative upper bound. Lean's GammaValid fp.u r is exactly the required specialization with m=r=log2(2^r), so it is a faithful explicitization rather than reduced applicability.",
      "primary_evidence": "PDF page 2, printed page 784, displays |theta_m| <= m*u/(1-m*u). D001 defines GammaValid u r as r*u<1, and D005 defines gamma u r as r*u/(1-r*u)."
    },
    {
      "item": "D002 and D007: floating-point model and exact zero",
      "resolution": "StandardAddModel directly axiomatizes the addition instance of model (1.2). Its operand-dependent existential delta has the correct scope. The exact-left-zero field packages the paper's exact initialization convention and standard addition behavior; it does not create a theorem about arithmetic outside the relative-error model.",
      "primary_evidence": "PDF page 2, printed page 784, states fl(x op y)=(x op y)(1+delta), |delta|<=u, and equation (2.1) begins modeled recursive additions at k=2 after the first input is retained exactly. D007 requires forall x y, exists delta with |delta|<=u and fl_add(x,y)=(x+y)(1+delta), together with fl_add(0,x)=x."
    },
    {
      "item": "S11: underflow and exceptional values",
      "resolution": "The paper's no-underflow statement delimits when model (1.2) applies. Lean assumes that relative-error equation directly for every modeled addition, so an execution whose underflow, overflow, or nonfinite result violates the equation cannot instantiate StandardAddModel. The target makes no broader exceptional-value claim.",
      "primary_evidence": "Immediately after model (1.2), printed page 784 says that no floating-point underflows are assumed and that machines lacking a guard digit violate the model. D007 supplies the model equation over real outputs, while the target contains no exceptional-value type or predicate."
    },
    {
      "item": "D006: algorithm linkage",
      "resolution": "Lean's lower-half/upper-half recursion is the same balanced adjacent-pair expression tree used by the paper when n=2^r. The depth-first definitional presentation does not change the arithmetic expression because the modeled operation is a fixed pure binary function.",
      "primary_evidence": "Printed page 788 defines pairwise summation by repeatedly summing adjacent pairs and then assumes n=2^r. D006 returns the sole input at r=0 and at r+1 combines recursive sums of indices 0,...,2^r-1 and 2^r,...,2^(r+1)-1."
    },
    {
      "item": "power-of-two ambiguity",
      "resolution": "The declaration exactly matches the case used to derive equation (3.6) and asserts nothing for arbitrary non-power-of-two lengths.",
      "primary_evidence": "Printed page 788 says 'Assume for simplicity that n=2^r' immediately before the pathwise representation and equation (3.6). Lean binds v : Fin(2^r) -> Real and uses an r-level balanced tree."
    },
    {
      "item": "all-zero nonnegative input ambiguity",
      "resolution": "No nonzero-sum hypothesis is missing because the target is an absolute bound. For all-zero inputs, equation (3.6) has zero on the right and model (1.2) forces every zero-plus-zero node to return zero. Only the separate relative quotient and R_n are undefined.",
      "primary_evidence": "Printed page 788 states the absolute bound without division by S_n. Printed page 785 introduces division by |S_n| only in the later relative rewrite. The Lean target contains no such division, and D007 implies fl_add(0,0)=0."
    },
    {
      "item": "initial input representability ambiguity",
      "resolution": "The selected paper analysis treats x_1,...,x_n as exact real addends and includes no initial input-rounding term. Lean makes the same abstraction by taking a real vector and rounding only applications of fl_add.",
      "primary_evidence": "Printed page 784 calls x_1,...,x_n real numbers and defines S_n as their exact sum. In Lean, v has real values, Finset.sum is exact real addition, and only pairwiseSum invokes fp.fl_add."
    },
    {
      "item": "implication directions",
      "resolution": "Both implication directions are yes when the paper side is correctly scoped to the selected nonnegative specialization. Consequently the fixed classification table requires faithful-equivalent; there is no claimed stronger theorem to justify.",
      "primary_evidence": "Under hv, sum_i |v i|=sum_i v i, n=2^r gives log2 n=r, D005 gives the same gamma_r, and D006 gives the same computed pairwise tree. Conversely, equation (3.6) under those substitutions yields the exact Lean conclusion."
    }
  ],
  "implications": {
    "lean_implies_paper": {
      "verdict": "yes",
      "reasoning": "Unfolding GammaValid, gamma, pairwiseSum, and the exact Finset sum gives the paper's power-of-two balanced pairwise computation and gamma_r absolute bound on nonnegative inputs. This implication is to the selected nonnegative specialization and does not assert unrestricted equation (3.6) for signed inputs."
    },
    "paper_implies_lean": {
      "verdict": "yes",
      "reasoning": "Apply equation (3.6) with n=2^r to the tree defined by pairwiseSum. StandardAddModel supplies the per-addition relative-error witnesses, GammaValid supplies the mathematically necessary positive denominator, and hv gives sum_i |v i|=sum_i v i. This yields the Lean inequality, including the all-zero case."
    }
  },
  "classification": "faithful-equivalent",
  "accepted": true,
  "remaining_uncertainties": [
    "The PDF does not print the usual condition m*u<1 beside the finite-product estimate; its intended necessity is inferred from the denominator and from the inequality's mathematical validity.",
    "The paper does not formalize initial representability, overflow, infinities, or NaNs. This adjudication is therefore limited to the real-valued standard relative-error model used in the cited analysis."
  ],
  "findings": [
    {
      "severity": "note",
      "category": "selected-specialization",
      "evidence": "Equation (3.6) covers signed inputs, while the selected additional passage supplies the nonnegative simplification and the Lean target explicitly assumes nonnegative inputs.",
      "impact": "The declaration is equivalent to the selected nonnegative result but cannot replace the unrestricted signed-input equation (3.6)."
    },
    {
      "severity": "note",
      "category": "gamma-domain",
      "evidence": "The paper displays gamma_m=m*u/(1-m*u) without an adjacent side condition; Lean explicitly assumes r*u<1.",